,title,link,hood,price
0,Comfort & Convenience In North San Jose!,https://sfbay.craigslist.org/sby/apa/d/comfort-convenience-in-north/6567797926.html,(san jose north),$4216
1,"Vasona, Netflix, LightRail all nearby, AC, wood floor, large closets",https://sfbay.craigslist.org/sby/apa/d/vasona-netflix-lightrail-all/6567797174.html,(campbell),$2245
2,"Your favorite floorplan, SO SPACIOUS! Ready now!",https://sfbay.craigslist.org/sby/apa/d/your-favorite-floorplan-so/6567796615.html,(santa clara),$3523
3,"LightRail Shuttle, Near Netflix, Dbl pane windows, gym, spa, pool,",https://sfbay.craigslist.org/sby/apa/d/lightrail-shuttle-near/6567796402.html,(campbell),$2645
4,"Recreation Room, Remodled Kitchens, Laundry Faciliites, Clubhouse",https://sfbay.craigslist.org/sby/apa/d/recreation-room-remodled/6561812490.html,(cupertino),$2750
5,"Your home! Newly remodeled,best schools,parks,shopping-pool.gym,spa!",https://sfbay.craigslist.org/sby/apa/d/your-home-newly-remodeledbest/6567795720.html,(campbell),$2895
6,"PATIO STORAGE, NEAR RANCH99, TRADER JOE'S, FITNESS CENTER, CALL TODAY",https://sfbay.craigslist.org/sby/apa/d/patio-storage-near-ranch99/6567795649.html,(sunnyvale),$3475
7,Love Where You Live! Make Santana Row Your Home! Come In Now!,https://sfbay.craigslist.org/sby/apa/d/love-where-you-live-make/6567792525.html,(san jose west),$3704
8,"Time for a change! Lease Today and Receive A $1,000 Move-In Bonus!",https://sfbay.craigslist.org/sby/apa/d/time-for-change-lease-today/6567791510.html,(willow glen / cambrian),$3130
9,Detached in law unit for rent in Evergreen,https://sfbay.craigslist.org/sby/apa/d/detached-in-law-unit-for-rent/6567770077.html,(san jose south),$1750
10,"Newly renovated 3/2 with Central A/C, Garage, Washer/Dryer and Patio",https://sfbay.craigslist.org/sby/apa/d/newly-renovated-3-2-with/6567788495.html,(campbell),$3145
11,"Minutes to restaurants! Updated 1BR apt, W. San Jose, Modern kitchen",https://sfbay.craigslist.org/sby/apa/d/minutes-to-restaurants/6565828751.html,(san jose west),$2095
12,"Lounge By The Pool. BBQ Grill, Gym Location and Rent Controlled.",https://sfbay.craigslist.org/sby/apa/d/lounge-by-the-pool-bbq-grill/6567775020.html,(san jose west),$2195
13,Move in to this amazing home aval in May.,https://sfbay.craigslist.org/sby/apa/d/move-in-to-this-amazing-home/6567786461.html,(santa clara),$2436
14,Move in to this amazing home aval in March.,https://sfbay.craigslist.org/sby/apa/d/move-in-to-this-amazing-home/6567785688.html,(santa clara),$2802
15,2b|1b Does Your Apartment Have A Fullsize W/D? Our Apartments Do!,https://sfbay.craigslist.org/sby/apa/d/2b1b-does-your-apartment-have/6567785091.html,(san jose downtown),$3035
16,New Upgraded Interiors available!!!!!,https://sfbay.craigslist.org/sby/apa/d/new-upgraded-interiors/6567784928.html,(Boca Raton),$2190
17,出租独立的套房(in-law unit)  $1800,https://sfbay.craigslist.org/sby/apa/d/in-law-unit-1800/6567782004.html,(milpitas),$1800
18,⌚ is Running Out! 1x1 Available now!,https://sfbay.craigslist.org/sby/apa/d/is-running-out-1x1-available/6567782745.html,(san jose downtown),$2511
19,"Move in Special, $500.00 off when you Tour and Lease Today*",https://sfbay.craigslist.org/sby/apa/d/move-in-specialoff-when-you/6567782353.html,(santa clara),$2930
20,Brand New Studio Apartment. Next to Apple Campus!,https://sfbay.craigslist.org/sby/apa/d/brand-new-studio-apartment/6567781335.html,(cupertino),$3010
21,LUSH LANDSCAPING & RESORT POOLS IN PRIME LOCATION,https://sfbay.craigslist.org/sby/apa/d/lush-landscaping-resort-pools/6567779402.html,(sunnyvale),$2200
22,SUNNYVALE'S BEST-AWARD-WINNING CUPERTINO SCHOOLS,https://sfbay.craigslist.org/sby/apa/d/sunnyvales-best-award-winning/6567777967.html,(sunnyvale),$2298
23,"Spin Studio, Landscaped Courtyard, Comfort and Convenience",https://sfbay.craigslist.org/sby/apa/d/spin-studio-landscaped/6567778777.html,(san jose north),$2810
24,SOPHISTICATED MODERN WILLOW GLEN HOME,https://sfbay.craigslist.org/sby/apa/d/sophisticated-modern-willow/6567723541.html,,$2500
25,L4 for clean roommate or couple to share luxury Sunnyvale apt complex,https://sfbay.craigslist.org/sby/apa/d/l4-for-clean-roommate-or/6565178963.html,(sunnyvale),$1600
26,Montebello Condo Large Gated 3Bd 2Ba For Lease $4500 per month,https://sfbay.craigslist.org/sby/apa/d/montebello-condo-large-gated/6567777750.html,(cupertino),$4500
27,Luxury Town Home Living In North San Jose!,https://sfbay.craigslist.org/sby/apa/d/luxury-town-home-living-in/6567776593.html,(san jose north),$2807
28,"Large Corner Apartment, Walk to Santa Clara Square Market Place",https://sfbay.craigslist.org/sby/apa/d/large-corner-apartment-walk/6561429109.html,(santa clara),$4515
29,HUGE SEPARATE DINING AREA AND PRIVATE PATIO IN THIS 2BR/2BA APARTMENT,https://sfbay.craigslist.org/sby/apa/d/huge-separate-dining-area-and/6567773771.html,(san jose west),$3403
30,Location Location! Great Price on This 2x2 Apartment Home!,https://sfbay.craigslist.org/sby/apa/d/location-location-great-price/6567773428.html,(san jose south),$2945
31,Single level 1 bed 1 bath with washer/dryer available soon,https://sfbay.craigslist.org/sby/apa/d/single-level-1-bed-1-bath/6567757379.html,(mountain view),$3126
32,Want 1 month free? Rent apt 522 to save big!,https://sfbay.craigslist.org/sby/apa/d/want-1-month-free-rent-apt/6567772436.html,(san jose south),$2605
33,☎ NOW! ONLY 2x2 Available | Move in 5/8!,https://sfbay.craigslist.org/sby/apa/d/now-only-2x2-available-move/6567771684.html,(san jose downtown),$3115
34,Bright One Bedroom One Bath Move In Today,https://sfbay.craigslist.org/sby/apa/d/bright-one-bedroom-one-bath/6567768597.html,(cupertino),$2627
35,"Spring is in the air, start fresh in this lovely apartment!",https://sfbay.craigslist.org/sby/apa/d/spring-is-in-the-air-start/6567670313.html,(san jose south),$2695
36,5 BEDROOM/3.5 BATH WITH 2 MASTER SUITES,https://sfbay.craigslist.org/sby/apa/d/5-bedroom-35-bath-with-2/6567764469.html,(san jose downtown),$5600
37,"- Kitchen Lounge + Dining Area, - Catering Kitchen, - Game Room-",https://sfbay.craigslist.org/sby/apa/d/kitchen-lounge-dining-area/6567763961.html,(mountain view),$3690
38,Beautiful 2bed/1 bath Duplex rent for long term !,https://sfbay.craigslist.org/sby/apa/d/beautiful-2bed-1-bath-duplex/6567745588.html,(gilroy),$2350
39,Extra Large 2 Bedroom 2 Bath - Available Immediately *$99 Deposit,https://sfbay.craigslist.org/sby/apa/d/extra-large-2-bedroom-2-bath/6567763028.html,(san jose south),$2700
40,Dreams DO Come True! Live In a NEW Apartment Home!🌟,https://sfbay.craigslist.org/sby/apa/d/dreams-do-come-true-live-in/6567762471.html,(campbell),$2750
41,"Resort Style Living On Santana Row Brand New Fit Studio, Pool & Spa!!",https://sfbay.craigslist.org/sby/apa/d/resort-style-living-on/6567761555.html,(san jose west),$3687
42,Pet Friendly Community - Bring Your Pups in Today!,https://sfbay.craigslist.org/sby/apa/d/pet-friendly-community-bring/6567738497.html,(san jose west),$2810
43,1/2 OFF FIRST MONTH'S RENT! LOCATION! LOCATION!,https://sfbay.craigslist.org/sby/apa/d/1-2-off-first-months-rent/6567760337.html,(san jose west),$2350
44,We have your Tropical paradise here at Laguna - come see this Beauty !,https://sfbay.craigslist.org/sby/apa/d/we-have-your-tropical/6567760200.html,(santa clara),$2386
45,"Monthly Temporay Furnished Apartment Alternative, For 4/29 Vacancy",https://sfbay.craigslist.org/sby/apa/d/monthly-temporay-furnished/6567760169.html,(san jose south),$1995
46,Fabulous studio apartment available! Just Reduced!,https://sfbay.craigslist.org/sby/apa/d/fabulous-studio-apartment/6567760072.html,(san jose downtown),$2868
47,*Move in Special - Two Bedroom One Bath with hardwood floors,https://sfbay.craigslist.org/sby/apa/d/move-in-special-two-bedroom/6567759213.html,(san jose south),$2430
48,4th floor corner home with natural light and good view |,https://sfbay.craigslist.org/sby/apa/d/4th-floor-corner-home-with/6557991765.html,(san jose south),$2248
49,Delightful and Elegant in a Convenient Location :),https://sfbay.craigslist.org/sby/apa/d/delightful-and-elegant-in/6567758168.html,(sunnyvale),$2753
50,Three Bedroom Three Bath 2 parking spaces Available Now *$99 Deposit,https://sfbay.craigslist.org/sby/apa/d/three-bedroom-three-bath-2/6567757819.html,(san jose south),$3365
51,"Decorative countertops, Stainless appliances, Renovated 2BR 1.5BA apt",https://sfbay.craigslist.org/sby/apa/d/decorative-countertops/6552657656.html,(cupertino),$2562
52,"Corner 4th floor home, Pool View, Sun, Gas Stove, A/C, W/D",https://sfbay.craigslist.org/sby/apa/d/corner-4th-floor-home-pool/6561933151.html,(willow glen / cambrian),$2248
53,Open House This Weekend,https://sfbay.craigslist.org/sby/apa/d/open-house-this-weekend/6567734100.html,(san jose downtown),$2645
54,"2 bed 2 bath Garage Parking, 2 Private Balconies, Washer/Dryer",https://sfbay.craigslist.org/sby/apa/d/2-bed-2-bath-garage-parking-2/6563790397.html,(West San Jose),$2795
55,"Pet Perfect 1x1: Large Patio, Plank Floors, W/D, AC, Great Location!",https://sfbay.craigslist.org/sby/apa/d/pet-perfect-1x1-large-patio/6567753552.html,(sunnyvale),$2907
56,"Right Around the Corner, Near Everywhere You Want to Be.",https://sfbay.craigslist.org/sby/apa/d/right-around-the-corner-near/6567752866.html,(campbell),$1895
57,Modern Loft in Historic Plant 51 in Downtown San Jose - 1bd/1.5ba,https://sfbay.craigslist.org/sby/apa/d/modern-loft-in-historic-plant/6558627751.html,(san jose downtown),$2850
58,One-of-a-Kind Loft for Rent at Plant 51 in Downtown San Jose,https://sfbay.craigslist.org/sby/apa/d/one-of-kind-loft-for-rent-at/6559215504.html,(san jose downtown),$2950
59,Gorgeous 1 Bedroom Condo @ Ryland Mews,https://sfbay.craigslist.org/sby/apa/d/gorgeous-1-bedroom-condo/6557555821.html,(san jose downtown),$2600
60,Beautiful Modern One Bedroom Condo at Ryland Mews in Downtown San Jose,https://sfbay.craigslist.org/sby/apa/d/beautiful-modern-one-bedroom/6563979074.html,(san jose downtown),$2800
61,"Energy efficient in-home laundry, Ample guest parking, Spa, Clubhouse",https://sfbay.craigslist.org/sby/apa/d/energy-efficient-in-home/6567750587.html,(santa clara),$3223
62,Brand New Home within gated community for rental immediate,https://sfbay.craigslist.org/sby/apa/d/brand-new-home-within-gated/6567746078.html,(gilroy),$3700
63,"1 bed x 1 bath, walk to Westgate Mall, Pergo, Granite Counters",https://sfbay.craigslist.org/sby/apa/d/1-bed-1-bath-walk-to-westgate/6567748662.html,(san jose west),$1825
64,"Upscale interiors, 1BR apt in downtown San Jose, Washer & dryer inside",https://sfbay.craigslist.org/sby/apa/d/upscale-interiors-1br-apt-in/6565828979.html,(san jose downtown),$2395
65,🔥hot🔥hot🔥Reserve today to Move in June!,https://sfbay.craigslist.org/sby/apa/d/hothotreserve-today-to-move/6554376099.html,(willow glen / cambrian),$3224
66,Living at its Best! Tour One Of Our Larger 2x2 Apts Today!,https://sfbay.craigslist.org/sby/apa/d/living-at-its-best-tour-one/6567748185.html,(cupertino),$3596
67,$500 off 1st month!! 2 bed/1 bath 3rd Floor! Move-in May 25th!,https://sfbay.craigslist.org/sby/apa/d/500-off-1st-month-2-bed-1/6567747936.html,(milpitas),$2725
68,Carve Out A Great Life at Vista 99!,https://sfbay.craigslist.org/sby/apa/d/carve-out-great-life-at-vista/6567747047.html,(san jose north),$3469
69,$500 off 1st month!! 2 bed/1 bath 3rd Floor! Move-in May 19th!,https://sfbay.craigslist.org/sby/apa/d/500-off-1st-month-2-bed-1/6567403835.html,(milpitas),$2725
70,$500 Off 1st Month!! 2 bed/1 bath Move-in May 19th! 3rd Floor!,https://sfbay.craigslist.org/sby/apa/d/500-off-1st-month-2-bed-1/6567502074.html,(milpitas),$2725
71,"Corner Home with Stainless Steel Appliances and Washer, Dryer Inside",https://sfbay.craigslist.org/sby/apa/d/corner-home-with-stainless/6567745981.html,(santa clara),$2677
72,1/2 OFF 1ST MONTH!! PERFECT LOCATIONS AND GORGEOUS APARTMENT!!!!,https://sfbay.craigslist.org/sby/apa/d/1-2-off-1st-month-perfect/6567745937.html,(san jose west),$2350
73,$250 Off 1st Month! 1 bed/ 1 bath Move-in May 19th! 3rd Floor!!,https://sfbay.craigslist.org/sby/apa/d/250-off-1st-month-1-bed-1/6567744723.html,(milpitas),$2445
74,Sunnyvale w/ Cupertino Schools. walking distance to Apple campus,https://sfbay.craigslist.org/sby/apa/d/sunnyvale-cupertino-schools/6567744577.html,(sunnyvale),$4500
75,Downtown Living - Enjoy 910 Sq. Ft. of Affrordable Luxury Living!,https://sfbay.craigslist.org/sby/apa/d/downtown-living-enjoy-910-sq/6567743058.html,(san jose downtown),$2788
76,"Beauty, Passion, Breathtaking Apartments.",https://sfbay.craigslist.org/sby/apa/d/beauty-passion-breathtaking/6567742822.html,(san jose north),$4577
77,single story 3/2 ranch,https://sfbay.craigslist.org/sby/apa/d/single-story-3-2-ranch/6567719966.html,,$2500
78,"Location, Community, Quality Living. It Starts Here!",https://sfbay.craigslist.org/sby/apa/d/location-community-quality/6567740477.html,(san jose north),$2899
79,REMODELED 3 Bedroom 2 Bathroom.  This is the ONE!,https://sfbay.craigslist.org/sby/apa/d/remodeled-3-bedroom-2/6567724466.html,(San Jose),$3100
80,"SFR! Walk 2 Almaden Lake, EZ access Oakridge Mall, 85, 87 light rail",https://sfbay.craigslist.org/sby/apa/d/sfr-walk-2-almaden-lake-ez/6567739679.html,(san jose south),$3200
81,"2bed x 2bath,Upstairs,walk to Country Lane Elementary&Westgate Mall",https://sfbay.craigslist.org/sby/apa/d/2bed-2bathupstairswalk-to/6567739126.html,(san jose west),$2488
82,"Convenient Location, WD In Apartment, Top Floor Apartment",https://sfbay.craigslist.org/sby/apa/d/convenient-location-wd-in/6567738715.html,(san jose downtown),$2710
83,"Spacious , Downstairs One Bedroom Available Now !",https://sfbay.craigslist.org/sby/apa/d/spacious-downstairs-one/6567738720.html,(san jose south),$2445
84,Get cozy in your beautiful new 1 Bedroom Apartment . Call us for Now,https://sfbay.craigslist.org/sby/apa/d/get-cozy-in-your-beautiful/6567730629.html,(san jose south),$1945
85,Always Fresh. Forever Original.,https://sfbay.craigslist.org/sby/apa/d/always-fresh-forever-original/6567736407.html,(san jose north),$3640
86,"Stunning Scenery, Relaxed Ambiance, Spacious & Lavish Living 1x1 !",https://sfbay.craigslist.org/sby/apa/d/stunning-scenery-relaxed/6567735145.html,(sunnyvale),$2914
87,Love Your New Home! 2x2 at Aviare with Private Garage!,https://sfbay.craigslist.org/sby/apa/d/love-your-new-home-2x2-at/6567732736.html,(cupertino),$2785
88,"U will Love our Beautiful Property - JUST IN, hurry, it won't last!",https://sfbay.craigslist.org/sby/apa/d/will-love-our-beautiful/6567731083.html,(cupertino),$3450
89,"Near Public Transportation, 24-Hour Package Acceptance, Swimming Pool",https://sfbay.craigslist.org/sby/apa/d/near-public-transportation-24/6567731050.html,(san jose south),$2422
90,"New on the Market, 2x2 bright top floor - Enjoy, your are home now!!!",https://sfbay.craigslist.org/sby/apa/d/new-on-the-market-2x2-bright/6558586103.html,(cupertino),$3450
91,"Just in: Great View, Garden-Style - LOVE everything about it",https://sfbay.craigslist.org/sby/apa/d/just-in-great-view-garden/6567729556.html,(cupertino),$3450
92,"1 DORMITORIO, 1 BAÑO DISPONIBLE $1,700/ MES $1,300 DEPOSITO",https://sfbay.craigslist.org/sby/apa/d/1-dormitorio-1-bao-disponible/6562375779.html,(san jose downtown),$1700
93,our two bedroom town house,https://sfbay.craigslist.org/sby/apa/d/our-two-bedroom-town-house/6567727977.html,(san jose west),$3309
94,One Bedroom Home With Hard Surface Flooring on the Ground Floor!,https://sfbay.craigslist.org/sby/apa/d/one-bedroom-home-with-hard/6567726488.html,(san jose north),$2728
95,$300 Off First Months Rent And Reduced Pricing At Misora!,https://sfbay.craigslist.org/sby/apa/d/300-off-first-months-rent-and/6567724759.html,(san jose west),$3691
96,Move in Ready! 3rd Floor! CLUBHOUSE FREE @ MI- Full Size W/D!,https://sfbay.craigslist.org/sby/apa/d/move-in-ready-3rd-floor/6567723805.html,(san jose north),$2359
97,"2.5 BATH, DESIGNER FEATURES, HIGH CEILING, 2-CAR GARAGE,SPACIOUS YARD",https://sfbay.craigslist.org/sby/apa/d/25-bath-designer-features/6567722547.html,(willow glen / cambrian),$3700
98,Newly Renovated Studio! Call Today!,https://sfbay.craigslist.org/sby/apa/d/newly-renovated-studio-call/6567721689.html,(san jose west),$2047
99,"Upstairs, sunny location",https://sfbay.craigslist.org/sby/apa/d/upstairs-sunny-location/6557708114.html,(san jose north),$1800
100,Adj to Beautiful Park Intel Apple This place will feel like home Dogs OK br1,https://sfbay.craigslist.org/sby/apa/d/adj-to-beautiful-park-intel/6567702556.html,(sunnyvale),$1830
101,Spacious Apartment downstairs,https://sfbay.craigslist.org/sby/apa/d/spacious-apartment-downstairs/6557683972.html,(santa clara),$2350
102,"2.5 bath, Townhouse, HW floors, New Appliances, A/c; Cupertino School",https://sfbay.craigslist.org/sby/apa/d/25-bath-townhouse-hw-floors/6562742596.html,(cupertino),$3400
103,Grand 2 Bedroom 2 Bath w/ Large Patio Available Here For You!,https://sfbay.craigslist.org/sby/apa/d/grand-2-bedroom-2-bath-large/6567719955.html,(sunnyvale),$4424
104,"1 Bed - 1 Bath, Pet-Friendly and ready to move-in today!!!!!",https://sfbay.craigslist.org/sby/apa/d/1-bed-1-bath-pet-friendly-and/6565733181.html,,$2190
105,1x1 Now Available Steps From Downtown Mountain View! Tour Today!,https://sfbay.craigslist.org/sby/apa/d/1x1-now-available-steps-from/6567718751.html,(mountain view),$4274
106,"new dual pane windows, and convenient separate laundry room. Relax or",https://sfbay.craigslist.org/sby/apa/d/new-dual-pane-windows-and/6567707257.html,"(SAN JOSE, CA)",$3050
107,"Walk Friendly!  Charming, Quiet Neighborhood",https://sfbay.craigslist.org/sby/apa/d/walk-friendly-charming-quiet/6567718321.html,(sunnyvale),$2145
108,A Fresh New Look 2x2 at Aviare! $500.00 Discount!,https://sfbay.craigslist.org/sby/apa/d/fresh-new-look-2x2-at/6567718278.html,(cupertino),$3350
109,Beautiful 2 Bedroom 2 Bath Townhomes At La Terraza!,https://sfbay.craigslist.org/sby/apa/d/beautiful-2-bedroom-2-bath/6567717444.html,(san jose west),$3020
110,First Floor 1b|1b in Beautiful Downtown San Jose! Call Today To Tour!,https://sfbay.craigslist.org/sby/apa/d/first-floor-1b1b-in-beautiful/6567715071.html,(san jose downtown),$2435
111,Beautiful Apartment for Rent in Downtown San Jose,https://sfbay.craigslist.org/sby/apa/d/beautiful-apartment-for-rent/6567714730.html,(san jose downtown),$1475
112,1x1 Town House Downstairs/ Private Patio & Private Garage -Open Now,https://sfbay.craigslist.org/sby/apa/d/1x1-town-house-downstairs/6561476874.html,(cupertino),$2495
113,1BD/1BTH -RENOV-LRGE PRIVATE PATIO DECK!!,https://sfbay.craigslist.org/sby/apa/d/1bd-1bth-renov-lrge-private/6552094584.html,(LAX/Westchester),$2126
114,Sunny Corner Home Available Now! Don't Miss Out!,https://sfbay.craigslist.org/sby/apa/d/sunny-corner-home-available/6567694175.html,(santa clara),$3859
115,Many long term residents a great place to live pets pets OK no smoking,https://sfbay.craigslist.org/sby/apa/d/many-long-term-residents/6567712499.html,(sunnyvale),$2240
116,Brand New Master Rm & Private Bath close to Downtown San Jose,https://sfbay.craigslist.org/sby/apa/d/brand-new-master-rm-private/6560225049.html,(san jose south),$1850
117,2BA UNITS IN A CLEAN QUIET BLDG. Cat Ok 7 minutes to Apple Netflix bo2,https://sfbay.craigslist.org/sby/apa/d/2ba-units-in-clean-quiet-bldg/6567710086.html,(san jose west),$2395
118,Room in cupertino near apple campus,https://sfbay.craigslist.org/sby/apa/d/room-in-cupertino-near-apple/6567709306.html,(cupertino),$1100
119,Renovated 1bd/1ba in Beautiful Community!Everything you could ask for!,https://sfbay.craigslist.org/sby/apa/d/renovated-1bd-1ba-in/6567707849.html,(san jose downtown),$2761
120,Private Apartment - 1 bed/bath - Downtown LG,https://sfbay.craigslist.org/sby/apa/d/private-apartment-1-bed-bath/6567708334.html,(los gatos),$2550
121,2 bed 2 bath Courtyard View,https://sfbay.craigslist.org/sby/apa/d/2-bed-2-bath-courtyard-view/6567706652.html,(campbell),$2780
122,CLICK TO UNLOCK THIS SPECIAL !!!,https://sfbay.craigslist.org/sby/apa/d/click-to-unlock-this-special/6567706630.html,(san jose west),$2138
123,Come Experience The Verdant Lifestyle! Apply Today and Save $799!,https://sfbay.craigslist.org/sby/apa/d/come-experience-the-verdant/6567706557.html,(san jose north),$3275
124,Pool Apple Google Cat OK AC Friendly Community Dishwasher Mature Landscaping bo1,https://sfbay.craigslist.org/sby/apa/d/pool-apple-google-cat-ok-ac/6567706508.html,(san jose west),$1890
125,Wonderful 2B2B Near Top Silicon Valley Companies!,https://sfbay.craigslist.org/sby/apa/d/wonderful-2b2b-near-top/6565767799.html,,$3522
126,dogs cats OK Single Story AC great home bd1,https://sfbay.craigslist.org/sby/apa/d/dogs-cats-ok-single-story-ac/6567705571.html,(santa clara),$1830
127,2 bedroom 2 bathroom ready now... Top floor w/fireplace & WD,https://sfbay.craigslist.org/sby/apa/d/2-bedroom-2-bathroom-ready/6567705426.html,(san jose south),$2588
128,WAIVED APPLICATION FEE & $99 DEPSOIT,https://sfbay.craigslist.org/sby/apa/d/waived-application-fee-99/6567698800.html,(san jose south),$2593
129,Intel Google Apple Dogs Cats Welcome Central Air bds,https://sfbay.craigslist.org/sby/apa/d/intel-google-apple-dogs-cats/6567704658.html,(santa clara),$1740
130,** Fully Furnished Private Entrance With Private Bathroom In Law,https://sfbay.craigslist.org/sby/apa/d/fully-furnished-private/6561588223.html,(santa clara),$1475
131,Cupertino Townhome,https://sfbay.craigslist.org/sby/apa/d/cupertino-townhome/6562749716.html,(cupertino),$3550
132,Great Apartment Available in heart of Sunnyvale,https://sfbay.craigslist.org/sby/apa/d/great-apartment-available-in/6567701276.html,(sunnyvale),$2350
133,"Very spacious layout, Look & Lease 1B1B !!",https://sfbay.craigslist.org/sby/apa/d/very-spacious-layout-look/6567699896.html,(sunnyvale),$2705
134,new remodeled single family house for rent,https://sfbay.craigslist.org/sby/apa/d/new-remodeled-single-family/6560445122.html,(san jose south),$3550
135,Beautiful 1b/1b lease transfer from april 15th.w/d inside home!,https://sfbay.craigslist.org/sby/apa/d/beautiful-1b-1b-lease/6561869454.html,(sunnyvale),$1995
136,"2Bed x 1Bath: Upstairs, High Ceiling & Pergo Floor &Granite Counters",https://sfbay.craigslist.org/sby/apa/d/2bed-1bath-upstairs-high/6567681679.html,(san jose west),$2350
137,1x1 Enjoy the Beauty of San Jose in this Perfect Location!,https://sfbay.craigslist.org/sby/apa/d/1x1-enjoy-the-beauty-of-san/6567669875.html,(san jose west),$1895
138,"If You're Not Living Here, Then You Aren't Living At All!",https://sfbay.craigslist.org/sby/apa/d/if-youre-not-living-here-then/6567696112.html,(sunnyvale),$3266
139,OLD VICTORIAN SPLIT INTO ROOMS,https://sfbay.craigslist.org/sby/apa/d/old-victorian-split-into-rooms/6567694326.html,(san jose downtown),$800
140,Beautiful two bedroom home with dramatic vaulted ceilings,https://sfbay.craigslist.org/sby/apa/d/beautiful-two-bedroom-home/6567692608.html,(san jose west),$2700
141,2 Bed/2 Bath 1 story House PLUS workshop with room + 1/2 bath,https://sfbay.craigslist.org/sby/apa/d/2-bed-2-bath-1-story-house/6567693569.html,(san jose west),$3500
142,Newly remodeled 2bedroom1bath apt for rent,https://sfbay.craigslist.org/sby/apa/d/newly-remodeled-2bedroom1bath/6567690285.html,(campbell),$2495
143,Special promotion on this 1x1 with laundry room inside home !!!,https://sfbay.craigslist.org/sby/apa/d/special-promotion-on-this-1x1/6567688663.html,(santa clara),$2826
144,"San Jose downtown, 2BR apt w/ Spacious living, Fully-equipped kitchen",https://sfbay.craigslist.org/sby/apa/d/san-jose-downtown-2br-apt/6560161361.html,(san jose downtown),$2650
145,"Commute-friendly area, Santa Clara 1BR 1BA apt, New kitchen & bath!",https://sfbay.craigslist.org/sby/apa/d/commute-friendly-area-santa/6565761846.html,(santa clara),$2095
146,"Tastefully remodeled, in pristine condition near Brocade, Samsung ...",https://sfbay.craigslist.org/sby/apa/d/tastefully-remodeled-in/6567685858.html,(san jose north),$4000
147,13 Rooms 4 Baths (Care/Group Home) Huge Roomy House in Stockton,https://sfbay.craigslist.org/sby/apa/d/13-rooms-4-baths-care-group/6545103780.html,(Stockton),$2985
148,2Bed x 1Bath: High Ceiling & Pergo Floor & Granite Counters &huge de,https://sfbay.craigslist.org/sby/apa/d/2bed-1bath-high-ceiling-pergo/6567685616.html,(san jose west),$2450
149,***Private Location W/ In-Home Washer & Dryer***,https://sfbay.craigslist.org/sby/apa/d/private-location-in-home/6567684841.html,(sunnyvale),$2812
150,1Bedroom 1Bathroom Lease Here @Brookside Oaks Today !!,https://sfbay.craigslist.org/sby/apa/d/1bedroom-1bathroom-lease-here/6567681840.html,(sunnyvale),$2705
151,Sunny Town Home With 3 Floors Of Luxury!,https://sfbay.craigslist.org/sby/apa/d/sunny-town-home-with-3-floors/6567679925.html,(san jose north),$3271
152,"Big 2BD/1BA! CONTROLLED ACCESS, PARK LIKE SETTING!",https://sfbay.craigslist.org/sby/apa/d/big-2bd-1ba-controlled-access/6567679015.html,(mountain view),$2750
153,"LEX Has Everything You Need, Join Us Today--Open House This Weekend!",https://sfbay.craigslist.org/sby/apa/d/lex-has-everything-you-need/6567678450.html,(san jose south),$29903165
154,"Enjoy Comfort, Convenience and Tranquility in a 1BD/1BA at Quail Ridge",https://sfbay.craigslist.org/sby/apa/d/enjoy-comfort-convenience-and/6567676682.html,(morgan hill),$1895
155,Check Out This 2x2 Apartment near Shopping and Dining Options!,https://sfbay.craigslist.org/sby/apa/d/check-out-this-2x2-apartment/6567676588.html,(san jose north),$2716
156,Pet-Friendly 1BR/1BA Apt. Home Available with Great Amenities,https://sfbay.craigslist.org/sby/apa/d/pet-friendly-1br-1ba-apt-home/6567676271.html,(santa clara),$2093
157,Looking for the PERFECT 1BD/1BA? Find it at Quail Ridge TODAY!,https://sfbay.craigslist.org/sby/apa/d/looking-for-the-perfect-1bd/6567676188.html,(morgan hill),$1895
